filename,Key Skills,Overall Analysis,Certifications & Courses,Relevant Projects,Soft Skills,Overall Match Score,Projects Relevance Score,Experience Relevance Score,Certifications Relevance Score,Final Score,Relative Ranking Score
resume_1763444321.pdf,"['Python', 'Machine Learning', 'PyCaret', 'Kaggle', 'Logistic Regression', 'Random Forest', 'SVM', 'JavaScript', 'Express.js', 'MongoDB', 'Node.js', 'Postman']","The candidate has a strong foundation in computer science and machine learning, with experience in developing scalable ML models and secure software solutions. However, the candidate's experience in LLMs, transformers, and modern AI stacks is limited.",[],"['Diamond Clarity Prediction Using Machine Learning', 'Secure Share – Secure File Sharing System']","['Collaboration', 'Communication', 'Problem-solving', 'Adaptability', 'Ethical conduct']",6,7,5,0,0,0.0
resume_1763444322.pdf,"['Python', 'Java', 'C', 'C++', 'Javascript', 'React.js', 'Next.js', 'Node.js', 'Express.js', 'MongoDB', 'MERN Stack']","The candidate has a strong foundation in programming languages and web development, but lacks experience in machine learning and AI. The candidate's projects demonstrate full-stack development skills, but are not directly related to machine learning or AI.",[],"['Job Portal', 'Dynamic Blog Website']","['Teamwork', 'Problem-solving']",2,1,1,0,0,0.0
resume_1763444323.pdf,"['Python', 'Machine Learning', 'Data Science']","The candidate has some relevant skills and education, but lacks direct experience in building and deploying machine learning models and AI systems. The internship experience is a good start, but more hands-on experience is required.",['Data Science training from Corizo'],['Minor and major projects on industry standard problems during internship'],[],4,2,1,1,0,0.0
resume_1763444325.pdf,"['Python', 'Machine Learning', 'Deep Learning', 'CNN', 'NumPy', 'Pandas', 'scikit-learn', 'PyTorch', 'TensorFlow', 'LLMs', 'Transformers', 'MLOps', 'Docker', 'CI/CD', 'MLFlow', 'Kubernetes', 'Cloud ML', 'AWS', 'GCP', 'Azure', 'Data Pipelines', 'ETL Tools']","The candidate has a strong foundation in computer science and machine learning, with relevant projects and skills that align with the job description. However, the candidate lacks direct experience with some of the required technologies and tools, such as Docker, CI/CD, and Kubernetes.","['HTML, CSS and JavaScript – Udemy', 'JavaScript – Digital Garage (Google)']","['Driver’s Drowsiness Detection in ADAS', 'Malware Detection using CNN in Emails', 'AI Driven - Post Office Identification System']","['Teamwork', 'Communication', 'Problem-solving', 'Time management']",7,8,6,5,0,0.0
resume_1763444326.pdf,[],"The candidate lacks experience in machine learning, AI, and data science, with a background in cybersecurity and web development. The skills required for the job are not met.",[],[],"['problem-solving', 'teamwork', 'communication']",2,1,1,1,0,0.0
