filename,Key Skills,Overall Analysis,Certifications & Courses,Relevant Projects,Soft Skills,Overall Match Score,Projects Relevance Score,Experience Relevance Score,Certifications Relevance Score,Final Score,Relative Ranking Score
resume_1763444325.pdf,"['Python', 'Machine Learning', 'Deep Learning', 'CNN', 'NumPy', 'Pandas']","The candidate has a strong foundation in machine learning and deep learning, with experience in building and optimizing ML models. However, the candidate lacks experience with specific technologies mentioned in the job description, such as scikit-learn, PyTorch, and TensorFlow.","['HTML, CSS and JavaScript - Udemy', 'JavaScript - Digital Garage (Google)']","[""Driver's Drowsiness Detection in ADAS"", 'Malware Detection using CNN in Emails', 'AI Driven - Post Office Identification System']","['Collaboration', 'Communication', 'Problem-solving']",6,8,5,4,430,100.0
resume_1763444321.pdf,"['Python', 'Machine Learning', 'PyCaret', 'Kaggle', 'Logistic Regression', 'Random Forest', 'SVM', 'JavaScript', 'Express.js', 'MongoDB', 'Node.js', 'Postman']","The candidate has a strong foundation in computer science and machine learning, with experience in Python, ML models, and data analysis. However, the candidate lacks experience in deep learning, LLMs, and cloud ML platforms, which are required for the job.",[],['Diamond Clarity Prediction Using Machine Learning'],"['Problem-solving', 'Data analysis', 'Scalable AI solutions', 'Communication skills', 'Team collaboration']",6,7,5,0,325,72.0
resume_1763444323.pdf,"['Python', 'Data Science', 'Machine Learning', 'Data Structures', 'Database Management System (DBMS)']","The candidate has some relevant skills, but lacks direct experience in machine learning and AI. The internship experience is limited, and the skills mentioned are mostly theoretical.","['Data Science Training (Corizo, Virtual)']",['Minor and major projects on industry standard problems (details not specified)'],[],4,2,1,3,140,22.67
resume_1763444322.pdf,"['Python', 'Java', 'C', 'C++', 'Javascript', 'React.js', 'Next.js', 'Node.js', 'Express.js', 'MongoDB']","The candidate has a strong foundation in programming languages and web development, but lacks experience in machine learning and AI. The candidate's projects are focused on web development and do not demonstrate expertise in ML/AI.",[],[],"['teamwork', 'problem-solving']",2,1,1,0,55,0.0
resume_1763444326.pdf,"['Python', 'Penetration testing', 'Web Security', 'CTF competitions', 'OWASP Top 10', 'Burp Suite', 'Nmap']","The candidate has a strong background in computer science and cybersecurity, but lacks direct experience in machine learning and AI. However, their skills in programming, problem-solving, and data analysis could be transferable.",[],['FlowVault: A Secure and High-Performance Peer-to-Peer File Sharing System'],"['Team-oriented', 'Problem-solving', 'Time management', 'Communication']",2,1,1,0,55,0.0
